Dextrin,-,Dextrin,Inactive,Low risk,,,Low,"Thickener, Stabilizer","Thickening agent; generally neutral, helps in stabilizing formulations without significant irritation.",0,0,0,0,0,Yes,Yes,Yes,Yes,Yes,Yes,Yes,Yes,Yes,Yes,Yes,Yes,No,Yes,Yes,Yes,Yes,Yes,Yes,Yes,Yes,No,Yes,Yes,Yes,Yes,Yes,Yes,Yes,Yes,0,,0,,0,,0,,0,,0.2,,0.2,,0,,0,,0,,0,,0,,0,0,0,0,0,0,0,0,0,0,0,0.2,0,0,0,0,0,0,0,0,0.2,0,0,0,0,0,0,0.2,0,0,1 - 5%,
Tromethamine,"Tromethamine, THAM",Tromethamine,Inactive,Low risk,,,Moderate,pH Adjuster,,0,0,0,0,0,Yes,Yes,Yes,Yes,Yes,Yes,Yes,Yes,Yes,Yes,Yes,Yes,No,Yes,Yes,Yes,Yes,Yes,Yes,Yes,Yes,No,Yes,Yes,Yes,Yes,Yes,Yes,Yes,Yes,-0.2,,0,,0,,0,,0,,0,,0,,0,,0,,0,,0,,0,,0,0,0,0,0,0,0,0,0,0,0,0,0,0,0,0,0,0,0,0,0,0,0,0,0,0,0,0,0,0,0.1 - 2%,
Mannitol,-,Mannitol,Inactive,Low risk,,,Low,Humectant,,0,0.2,0.2,0.2,0.2,Yes,Yes,Yes,Yes,Yes,Yes,Yes,Yes,Yes,Yes,Yes,Yes,No,Yes,Yes,Yes,Yes,Yes,Yes,Yes,Yes,No,Yes,Yes,Yes,Yes,Yes,Yes,Yes,Yes,0.2,"Mannitol: Acts as a moisturizing agent, calming the skin and reducing irritation and redness.",0.2,,0,,0,,0.2,,0,,0,,0,,0,,0,,0,,0,,1,0,1,0,0,0,0,0,0,0,0,0,0,0,0,0,0.2,0,0,0,0,0,0,0,0,0,0,0,0,0,0.5 - 2%,Yes
Acetyl Tetrapeptide-11,"Acetyl Tetrapeptide-11, Tetrapeptide-11",Acetyl Tetrapeptide-11,Active,Low risk,,,Low,Active,Skin barrier,0,1,0.2,0.2,0.2,Yes,Yes,Yes,Yes,Yes,Yes,Yes,Yes,Yes,Yes,Yes,Yes,No,Yes,Yes,Yes,Yes,Yes,Yes,No,Yes,No,Yes,Yes,Yes,Yes,Yes,Yes,Yes,Yes,1,"Acetyl Tetrapeptide-11 helps reduce inflammation and redness by modulating inflammatory responses and strengthening the skin barrier, addressing key issues in rosacea.",0,,0,,0.2,,0.2,,0.2,,1,"This peptide promotes the synthesis of proteins involved in cellular adhesion and cohesion, contributing to improved skin firmness and structure. It is effective in anti-aging formulations focused on increasing skin density and elasticity.",0.2,,0,,0.2,,0.2,,0,,0,0,0,0,0,0,0,0,0,0,0,0.2,0,0,0,0.2,0,0,0.2,1,1,0,0,0,0,0,0,0.2,0,0,0.5 - 2%,Yes
Undaria Pinnatifida Extract,"Wakame Extract, Undaria Pinnatifida Seaweed Extract",Undaria Pinnatifida Extract,Active,Low risk,,,Low,Active,Contains antioxidants and anti-inflammatory properties; beneficial for soothing and protecting rosacea-prone skin.,0,0.2,0.2,0.2,0.2,Yes,Yes,Yes,Yes,Yes,Yes,Yes,Yes,Yes,Yes,Yes,Yes,No,Yes,Yes,Yes,Yes,Yes,Yes,Yes,Yes,Yes,Yes,Yes,Yes,Yes,Yes,Yes,Yes,Yes,0.2,,0,,0,,0.2,,0.2,,0.2,,0.2,,0.2,,0.2,,0.2,,0.2,,0,,0,0,0.2,0,0,0,0,0,0,0,0,0.2,0,0,0,0.2,0,1,0.2,0,0.2,0,0,0,0,0,1,0.2,1,0,0.1 - 2%,
Vitis Vinifera (Grape) Fruit Water,"Grape Fruit Water, Vitis Vinifera Fruit Water",Vitis Vinifera (Grape) Fruit Water,Active,Low risk,,,Low,Humectant,Antioxidant,0,0.2,0.2,0.2,0.2,Yes,Yes,Yes,Yes,Yes,Yes,Yes,Yes,Yes,Yes,Yes,Yes,No,Yes,Yes,Yes,Yes,Yes,Yes,Yes,Yes,Yes,Yes,Yes,Yes,Yes,Yes,Yes,Yes,Yes,0.2,,1,Vitis Vinifera (Grape) Fruit Water: Rich in antioxidants and polyphenols that help reduce the appearance of dark spots and promote a more even skin tone.,0.2,0.2,0.2,0.2,0.2,0.2,0.2,0.2,0.2,0.2,0.2,0.2,0.2,0.2,0.2,0.2,0.2,0.2,0.2,,0,0,0,0,0,0,0,0,0,0.2,0.2,0.2,0,0,0,0.2,1,0,0.2,0,0.2,0,0,0,0,0,0,0.2,1,0,1 - 5%,Yes
Isostearyl Isostearate,"Isostearyl Isostearate, Isostearyl Isostearate",Isostearyl Isostearate,Inactive,Low risk,,,Low,"Emollient, Occlusive Agent"," Emollient; generally neutral to beneficial, used to moisturize and improve skin texture.",1,0,0.2,0,0.2,Yes,Yes,Yes,Yes,Yes,Yes,Yes,Yes,Yes,No,No,No,No,Yes,Yes,Yes,Yes,Yes,Yes,Yes,Yes,No,Yes,Yes,Yes,Yes,Yes,Yes,Yes,Yes,0,,0,,-0.2,,0.2,,-0.2,,0,,0,,0,,0,,0.2,,0.2,,-0.2,,0.2,0,0,0,0,0,0,0,0,-0.2,-0.2,0,0,0,0,0.2,0,0,0,0,0,0,0,0,0,0,0,0,0,0,1 - 5%,
Vitis Vinifera (Grape) Juice,"Grape Juice, Vitis Vinifera Juice",Vitis Vinifera (Grape) Juice,Active,Low risk,,,Low,Humectant,Antioxidant,0,0.2,0.2,0.2,0.2,Yes,Yes,Yes,Yes,Yes,Yes,Yes,Yes,Yes,Yes,Yes,Yes,No,Yes,Yes,Yes,Yes,Yes,Yes,Yes,Yes,Yes,Yes,Yes,Yes,Yes,Yes,Yes,Yes,Yes,0.2,,1,Vitis Vinifera (Grape) Fruit Water: Rich in antioxidants and polyphenols that help reduce the appearance of dark spots and promote a more even skin tone.,0.2,0.2,0.2,0.2,0.2,0.2,0.2,0.2,0.2,0.2,0.2,0.2,0.2,0.2,0.2,0.2,0.2,0.2,0.2,,0,0,0,0,0,0,0,0,0,0.2,0.2,0.2,0,0,0,0.2,1,0,0.2,0,0.2,0,0,0,0,0,0,0.2,1,0,1 - 5%,Yes
Dehydroacetic Acid,"Dehydroacetic Acid, DHA",Dehydroacetic Acid,Active,Low risk,,,Low,Preservative,"Preservative; generally neutral, used to prevent microbial growth and maintain product stability.",0,0,0,0,0,Yes,Yes,Yes,Yes,Yes,Yes,Yes,Yes,Yes,Yes,Yes,Yes,No,Yes,Yes,Yes,Yes,Yes,Yes,Yes,Yes,No,Yes,Yes,Yes,Yes,Yes,Yes,Yes,Yes,0,,0,,0,,0,,0,,0,,0,,0,,0,,0,,0,,0,,0,0,0,0,0,0,0,0,0,0,0,0,0,0,0,0,0,0,0,0,0,0,0,0,0,0,0,0,0,0,0.1 - 2%,
Sodium Carboxymethyl Beta-Glucan,"Sodium Carboxymethyl Beta-Glucan, Sodium Carboxymethyl Beta Glucan",Sodium Carboxymethyl Beta-Glucan,Active,Low risk,,,Low,Humectant,,0,0.2,1,0.2,0.2,Yes,Yes,Yes,Yes,Yes,Yes,Yes,Yes,Yes,Yes,Yes,Yes,No,Yes,Yes,Yes,Yes,Yes,Yes,Yes,Yes,No,Yes,Yes,Yes,Yes,Yes,Yes,Yes,Yes,0.2,,0.2,,0,,1,A moisturizing agent that promotes skin hydration by forming a film on the skin’s surface to prevent moisture loss. It also supports skin healing and repair.,0,,1,"This ingredient provides moisturizing benefits and can help improve skin texture, potentially reducing fine lines.",1,"By enhancing hydration, it supports skin elasticity and firmness.",0.2,,0.2,,0,,0.2,,0.2,,0.2,0,0.2,0,0,0,0,0,0,0,0.2,1,0,0,0,0,0.2,0,0.2,0,1,0,0,0,0,0,0,1,0,0,1 - 5%,Yes
Isopentyldiol,"Isopentyldiol, -",Isopentyldiol,Inactive,Low risk,,,Low,Humectant,"Humectant; generally neutral, helps in maintaining skin hydration.",0,0.2,0.2,0.2,0.2,Yes,Yes,Yes,Yes,Yes,Yes,Yes,Yes,Yes,Yes,Yes,Yes,No,Yes,Yes,Yes,Yes,Yes,Yes,Yes,Yes,No,Yes,Yes,Yes,Yes,Yes,Yes,Yes,Yes,0,,0.2,,0,,0,,0.2,,0,,0,,0,,0.2,,0,,0,,0,,0,0,0.2,0,0,0,0,0,0,0,0,0,0,0,0,0,0.2,0,0,0,0,0,0,0,0,0,0,0,0,0,1 - 5%,
Polyglyceryl-10 Stearate,"Polyglyceryl-10 Stearate, Polyglyceryl Stearate",Polyglyceryl-10 Stearate,Inactive,Low risk,,,Low,Emulsifier,"Emulsifier; generally neutral, helps in blending ingredients and maintaining hydration.",0,0,0,0.2,0.2,Yes,Yes,Yes,Yes,Yes,Yes,Yes,Yes,Yes,Yes,Yes,Yes,No,Yes,Yes,Yes,Yes,Yes,Yes,Yes,Yes,No,Yes,Yes,Yes,Yes,Yes,Yes,Yes,Yes,0,,0,,0,,0,,0,,0.2,,0.2,,0,,0,,0,,0,,0,,0.2,0,0,0,0,0,0,0,0,0,0,0.2,0,0,0,0,0,0,0,0,0.2,0,0,0,0,0,0,0.2,0,0,1 - 5%,
Inulin Lauryl Carbamate,"Inulin Lauryl Carbamate, Lauryl Inulin Carbamate",Inulin Lauryl Carbamate,Inactive,Low,,,Low,"Emulsifier, Texture Enhancer","Emulsifier and film-forming agent; generally neutral, helps in stabilizing and moisturizing formulations.",0,0.2,0.2,0.2,0.2,Yes,Yes,Yes,Yes,Yes,Yes,Yes,Yes,Yes,No,No,No,No,Yes,Yes,Yes,Yes,Yes,Yes,Yes,Yes,No,Yes,Yes,Yes,Yes,Yes,Yes,Yes,Yes,0,,0,,-0.2,,0,,0,,0,,0,,0,,0,,0,,0,,-0.2,,0,0,0,0,0,0,0,0,0,-0.2,-0.2,0,0,0,0,0,0,0,0,0,0,0,0,0,0,0,0,0,0,0,1 - 5%,
Tremella Fuciformis Sporocarp Extract,"Tremella Extract, Tremella Fuciformis Extract",Tremella Fuciformis Sporocarp Extract,Active,Low,,,Low,Humectant,"Strong humectant, moisture retention",0,0.2,0.2,0.2,0.2,Yes,Yes,Yes,Yes,Yes,Yes,Yes,Yes,Yes,Yes,Yes,Yes,No,Yes,Yes,Yes,Yes,Yes,Yes,Yes,Yes,Yes,Yes,Yes,Yes,Yes,Yes,Yes,Yes,Yes,0.2,,0.2,,0,,1,"Acts as a natural humectant, helping to attract and retain moisture in the skin.",0,,1,"Known for its hydrating properties, this mushroom extract can help reduce fine lines by keeping the skin plump and moisturized.",1,Its ability to retain moisture supports skin elasticity and firmness.,0.2,,0.2,,0.2,,0.2,,0,,1,0,1,0,0,0,0,0,0,0,0,1,0,0,0,0.2,0.2,0,0.2,0,1,0,0,0,0,0,0,1,0,0,1 - 5%,Yes
Camellia Japonica Flower Extract,"Camellia Japonica Extract, Camellia Japonica Flower Extract",Camellia Japonica Flower Extract,Active,Low,,,Low,Active,"Antioxidant, antiinflammatory",0,0.2,0.2,0.2,0.2,Yes,Yes,Yes,Yes,Yes,Yes,Yes,Yes,Yes,Yes,Yes,Yes,No,Yes,Yes,Yes,Yes,Yes,Yes,Yes,Yes,Yes,Yes,Yes,Yes,Yes,Yes,Yes,Yes,Yes,0.2,,0.2,,0.2,,0.2,,0,,0.2,,0.2,,0.2,,0.2,,0.2,,0.2,,0.2,,0,0.2,0,0,0,0,0,0,0,0.2,0.2,0.2,0,0,0,0.2,0.2,0,0.2,1,0.2,0,0,0,0,0,0,0.2,1,0,0.1 - 2%,
Isohexadecane,-,Isohexadecane,Inactive,Low,,,Low,"Emollient, Solvent","Emollient; generally neutral, helps to smooth and condition the skin.",1,0,0,0.2,0.2,Yes,Yes,Yes,Yes,Yes,Yes,Yes,Yes,Yes,Yes,Yes,Yes,No,Yes,Yes,Yes,Yes,Yes,Yes,Yes,Yes,No,Yes,Yes,Yes,Yes,Yes,Yes,Yes,Yes,0,,0,,0,,0.2,,0.2,,0,,0,,0,,0,,0,,0,,0,,0.2,0,0,0,0,0,0,0,0,0,0,0,0,0,0,0,0,0,0,0,0,0,0,0,0,0,0,0,0,1,1 - 5%,
Phospholipids,-,Phospholipids,Active,Low,,,Low,Emulsifier,Skin barrier,0,1,0.2,0.2,0.2,Yes,Yes,Yes,Yes,Yes,Yes,Yes,Yes,Yes,Yes,Yes,Yes,No,Yes,Yes,Yes,Yes,Yes,Yes,Yes,Yes,No,Yes,Yes,Yes,Yes,Yes,Yes,Yes,Yes,0.2,,0.2,,0,,0.2,,0.2,,0.2,,0.2,,0.2,,0,,0.2,,0.2,,0.2,,0.2,0,0,0,0,0,0,0,0,0,0.2,0.2,0,0,0,0.2,0.2,0,0.2,0,0.2,0,0,0,0,0,0,0.2,0,1,1 - 5%,
Hydrolyzed Opuntia Ficus-Indica Flower Extract,"Hydrolyzed Opuntia Extract, Hydrolyzed Opuntia Ficus-Indica Flower Extract",Hydrolyzed Opuntia Ficus-Indica Flower Extract,Active,Low,,,Low,Active,Antioxidant,0,0.2,0.2,0.2,0.2,Yes,Yes,Yes,Yes,Yes,Yes,Yes,Yes,Yes,Yes,Yes,Yes,No,Yes,Yes,Yes,Yes,Yes,Yes,Yes,Yes,Yes,Yes,Yes,Yes,Yes,Yes,Yes,Yes,Yes,0.2,,0.2,,0.2,,0.2,,0.2,,0.2,,0.2,,0.2,,0.2,,0,,0.2,,0.2,,0,0,0,0,1,1,0,0,0,0.2,0.2,0.2,0,0,0,0,0.2,0,0.2,0,0.2,0,0,0,0,0,0,0.2,1,0,0.5 - 2%,
Dipropylene Glycol,"Dipropylene Glycol, DPG",Dipropylene Glycol,Inactive,Low,,,Low,Solvent," Solvent and humectant; generally neutral, helps in maintaining moisture and stability.",0,0,0,0,0,Yes,Yes,Yes,Yes,Yes,Yes,Yes,Yes,Yes,Yes,Yes,Yes,Yes,Yes,Yes,Yes,Yes,Yes,Yes,Yes,Yes,No,Yes,Yes,Yes,Yes,Yes,Yes,Yes,Yes,0,,0,,0,,0,,0,,0.2,,0.2,,0,,0,,0,,0,,0,,0,0,0,0,0,0,0,0,0,0,0,0.2,0,0,0,0,0,0,0,0,0.2,0,0,0,0,0,0,0.2,0,0,1 - 5%,
Alcohol Denat.,"Denatured Alcohol, Alcohol Denat.",Alcohol Denat.,Inactive,Moderate,,,High,Solvent,,0,0,-0.2,-0.2,-0.2,Yes,Yes,Yes,Yes,Yes,Yes,Yes,Yes,No,No,No,No,Yes,Yes,Yes,Yes,Yes,Yes,Yes,Yes,Yes,No,Yes,Yes,Yes,Yes,Yes,Yes,Yes,Yes,-6,,-6,,-1,,-6,,-0.2,,-0.2,,-0.2,,-0.2,,-0.2,,-1,,-6,,-1,,0,0,0,0,0,0,0,0,0,-1,-1,-0.2,0,0,0,-1,-6,0,-0.2,0,-0.2,0,0,0,0,0,0,-0.2,0,0,1 - 5%,
Cyclopentasiloxane,"CPS, Cyclopentasiloxane",Cyclopentasiloxane,Inactive,Low,,,Low,"Emollient, Occlusive Agent",Silicone-based; provides a smooth finish and moisture retention; generally neutral but can be occlusive for sensitive skin.,0,0,0,0.2,0.2,Yes,Yes,Yes,Yes,Yes,Yes,Yes,Yes,Yes,No,No,No,Yes,Yes,Yes,Yes,Yes,Yes,Yes,Yes,Yes,No,Yes,Yes,Yes,Yes,Yes,Yes,Yes,Yes,0,,0,,-0.2,,0,Provides a silky feel and helps other moisturizing ingredients penetrate the skin.,0,,0,,0,,0.2,,0,,0.2,,0.2,,-0.2,,0,0,0,0,0,0,0,0,0,-0.2,-0.2,0,0,0,0,0.2,0,0,0.2,0,0,0,0,0,0,0,0,0,0,0,1 - 5%,
PEG/PPG/Polybutylene Glycol-8/5/3 Glycerin,"PEG/PPG/Polybutylene Glycol-8/5/3 Glycerin, PEG/PPG/Polybutylene Glycol Glycerin",PEG/PPG/Polybutylene Glycol-8/5/3 Glycerin,Inactive,Low,,,Low,"Humectant, Solvent",,0,0,0,0.2,0.2,Yes,Yes,Yes,Yes,Yes,Yes,Yes,Yes,Yes,Yes,Yes,Yes,Yes,Yes,Yes,Yes,Yes,Yes,Yes,Yes,Yes,No,Yes,Yes,Yes,Yes,Yes,Yes,Yes,Yes,0.2,"PEG/PPG/Polybutylene Glycol-8/5/3 Glycerin: Provides moisturizing and soothing properties, reducing dryness and irritation associated with rosacea.",0.2,,0,,0,"Functions as a humectant and emollient, attracting moisture and softening the skin.",0,,0,,0,,0,,0.2,,0.2,,0,,0,,1,0,0.2,0,0,0,0,0,0,0,0,0,0,0,0,0.2,0.2,0,0,0,0,0,0,0,0,0,0,0,0,0,1 - 5%,Moderately effective
Nepeta Cataria Extract,"Catnip Extract, Nepeta Cataria",Nepeta Cataria Extract,Active,Low,,,Low,Active,Contains anti-inflammatory properties; beneficial for calming and reducing redness.,0,0.2,0.2,0.2,0.2,Yes,Yes,Yes,Yes,Yes,Yes,Yes,Yes,Yes,Yes,Yes,Yes,No,Yes,Yes,Yes,Yes,Yes,Yes,Yes,Yes,Yes,Yes,Yes,Yes,Yes,Yes,Yes,Yes,Yes,0.2,,0,,0.2,,0.2,,0,,0,,0,,0,,0,,0,,0,,0.2,,0,0,0,0,0.2,0.2,0,0,0,0.2,0.2,0,0,0,0,0,0,1,0,0,0,0,0,0,0,0,0,0,0,0,0.1 - 2%,
Rubus Idaeus (Raspberry) Leaf Extract,"Raspberry Leaf Extract, Rubus Idaeus Leaf Extract",Rubus Idaeus (Raspberry) Leaf Extract,Active,Low,,,Low,Active,Antioxidant,0,0.2,0.2,0.2,0.2,Yes,Yes,Yes,Yes,Yes,Yes,Yes,Yes,Yes,Yes,Yes,Yes,No,Yes,Yes,Yes,Yes,Yes,Yes,Yes,Yes,Yes,Yes,Yes,Yes,Yes,Yes,Yes,Yes,Yes,0.2,,0.2,,0.2,,0.2,,0.2,,0.2,,0.2,,0.2,,0.2,,0.2,,0.2,,0.2,,0,0,0,0,0,0,0,0,0,0.2,0.2,0.2,0,0,0,0.2,0.2,0,0.2,0,0.2,0,0,0,0,0,0,0.2,1,0,0.1 - 2%,
Baptisia Tinctoria Root Extract,"Baptisia Root Extract, False Indigo Root Extract",Baptisia Tinctoria Root Extract,Active,Low,,,Low,Active,Antioxidant,0,0.2,0.2,0.2,0.2,Yes,Yes,Yes,Yes,Yes,Yes,Yes,Yes,Yes,Yes,Yes,Yes,No,Yes,Yes,Yes,Yes,Yes,Yes,Yes,Yes,Yes,Yes,Yes,Yes,Yes,Yes,Yes,Yes,Yes,0.2,,0,,0.2,,0.2,,0,,0.2,,0.2,,0.2,,0.2,,0.2,,0.2,,0.2,,0,0,0,0,1,1,0,1,0,0.2,0.2,0.2,0,0,0,0.2,0,0,0.2,0,0.2,0,0,0,0,1,0,0.2,0,0,0.1 - 2%,
Stellaria Media (Chickweed) Extract,"Chickweed Extract, Stellaria Media Extract",Stellaria Media (Chickweed) Extract,Active,Low,,,Low,Active,Soothing and anti-inflammatory; beneficial for calming rosacea-prone skin.,0,0.2,0.2,0.2,0.2,Yes,Yes,Yes,Yes,Yes,Yes,Yes,Yes,Yes,Yes,Yes,Yes,No,Yes,Yes,Yes,Yes,Yes,Yes,Yes,Yes,Yes,Yes,Yes,Yes,Yes,Yes,Yes,Yes,Yes,0.2,,0,,0.2,,0.2,,0,,0,,0,,0,,0.2,,0,,0.2,,0.2,,0,0,0,0,1,1,0,0,0,0.2,0.2,0,0,0,0,0,0,1,0,0,0,0,0,0,0,0,0,0,0,0,0.1 - 2%,
Alchemilla Vulgaris Leaf Extract,"Lady’s Mantle Extract, Alchemilla Vulgaris",Alchemilla Vulgaris Leaf Extract,Active,Low,,,Low,Active,Antioxidant,0,0.2,0.2,0.2,0.2,Yes,Yes,Yes,Yes,Yes,Yes,Yes,Yes,Yes,Yes,Yes,Yes,No,Yes,Yes,Yes,Yes,Yes,Yes,Yes,Yes,Yes,Yes,Yes,Yes,Yes,Yes,Yes,Yes,Yes,0.2,,0,,0.2,,0.2,,0.2,,0.2,,0.2,,0.2,,0.2,,0.2,,0.2,,0.2,,0,0,0,0,0,0,0,0,0,0.2,0.2,0.2,0,0,0,0.2,0,1,0.2,0,0.2,0,0,0,0,0,0,0.2,0,0,0.1 - 2%,
Equisetum Arvense Leaf Extract,"Horsetail Extract, Equisetum Arvense",Equisetum Arvense Leaf Extract,Active,Low,,,Low,Active,Contains silica and anti-inflammatory properties; generally beneficial for reducing inflammation and supporting skin health.,0,0.2,0.2,0.2,0.2,Yes,Yes,Yes,Yes,Yes,Yes,Yes,Yes,Yes,Yes,Yes,Yes,No,Yes,Yes,Yes,Yes,Yes,Yes,Yes,Yes,Yes,Yes,Yes,Yes,Yes,Yes,Yes,Yes,Yes,0,,0,,0.2,,0.2,,0.2,,0.2,,1,"The extract has been shown to inhibit elastase enzymes, which break down elastin in the skin. By preventing elastin degradation, Equisetum arvense can help maintain skin elasticity and firmness. Its hydrating properties also contribute to overall skin health, supporting elasticity.",0.2,,0,,0.2,,0.2,,0.2,,0,0,0,0,0,0,0,0,0,0.2,0.2,0.2,0,0,0,0.2,0,0,0.2,0,1,0,0,0,0,0,0,0.2,1,0,1 - 5%,Yes
Urtica Dioica (Nettle) Leaf Extract,"Nettle Leaf Extract, Urtica Dioica Extract",Urtica Dioica (Nettle) Leaf Extract,Active,Moderate,,,Low,Active,Anti-inflammatory and astringent; beneficial for reducing redness and calming the skin.,0,0.2,0.2,0.2,0.2,Yes,Yes,Yes,Yes,Yes,Yes,Yes,Yes,Yes,Yes,Yes,Yes,No,Yes,Yes,Yes,Yes,Yes,Yes,Yes,Yes,Yes,Yes,Yes,Yes,Yes,Yes,Yes,Yes,Yes,0.2,,0,,0.2,,0.2,,0.2,,0,,0,,0.2,,0.2,,0.2,,0.2,,0.2,,0,0,0,0,0,0,0,0,0,0.2,0.2,0,0,0,0,0.2,0,1,0.2,0,0,0,1,0,0,0,0,0,0,0,0.1 - 2%,
Polymethylsilsesquioxane,"PMSQ, Polymethylsilsesquioxane",Polymethylsilsesquioxane,Inactive,Low,,,Low,"Emollient, Texture Enhancer","Silicone-based; generally neutral, helps to provide a smooth texture and moisture retention.",0,0,0,0.2,0.2,Yes,Yes,Yes,Yes,Yes,Yes,Yes,Yes,Yes,No,No,No,Yes,Yes,Yes,Yes,Yes,Yes,Yes,Yes,Yes,No,Yes,Yes,Yes,Yes,Yes,Yes,Yes,Yes,0,,0,,-0.2,,0.2,,0,,0,,0,,0.2,,0,,0.2,,0.2,,-0.2,,0,0,0,0,0,0,0,0,0,-0.2,-0.2,0,0,0,0,0.2,0,0,0.2,0,0,0,0,0,0,0,0,0,0,0,1 - 5%,
PEG-150,"Polyethylene Glycol-150, PEG-150",PEG-150,Inactive,Low,,,Low,"Thickener, Stabilizer",,0,0,0,0,0,Yes,Yes,Yes,Yes,Yes,Yes,Yes,Yes,Yes,Yes,Yes,Yes,Yes,Yes,Yes,Yes,Yes,Yes,Yes,Yes,Yes,No,Yes,Yes,Yes,Yes,Yes,Yes,Yes,Yes,-0.2,,0,,0,,0,,-0.2,,0,,0,,-0.2,,-0.2,,0,,0,,0,,0.2,0,0,0,0,0,0,0,0.2,0,0,0,0,0,0,0,0,0,-0.2,0,0,0,0,0,0,0,0,0,0,0,0.5 - 2%,
Phenyl Trimethicone,"Phenyl Trimethicone, Trimethylsiloxysilicate",Phenyl Trimethicone,Inactive,Low,,,Low,"Emollient, Texture Enhancer","Silicone-based; generally neutral, used for providing a smooth finish and improving skin texture.",0,0,0,0.2,0.2,Yes,Yes,Yes,Yes,Yes,Yes,Yes,Yes,Yes,Yes,Yes,Yes,Yes,Yes,Yes,Yes,Yes,Yes,Yes,Yes,Yes,No,Yes,Yes,Yes,Yes,Yes,Yes,Yes,Yes,0,,0,,0,,0,,0,,0,,0,,0.2,,0,,0.2,,0.2,,0,,0.2,0,0,0,0,0,0,0,0.2,0,0,0,0,0,0,0.2,0,0,0.2,0,0,0,0,0,0,0,0,0,0,0,1 - 5%,
PEG-40 Hydrogenated Castor Oil,"PEG-40 Castor Oil, PEG-40 Hydrogenated Castor Oil",PEG-40 Hydrogenated Castor Oil,Inactive,Low,,,Low,Emulsifier,,0,0,0,0,0,Yes,Yes,Yes,Yes,Yes,Yes,Yes,Yes,Yes,No,No,No,Yes,Yes,Yes,Yes,Yes,Yes,Yes,Yes,Yes,No,Yes,Yes,Yes,Yes,Yes,Yes,Yes,Yes,-0.2,,0,,-0.2,,0,,0,,0,,0,,-0.2,,0,,0,,0,,-0.2,,0,0,0,0,0,0,0,0,0,-0.2,-0.2,0,0,0,0,0,0,0,-0.2,0,0,0,0,0,0,0,0,0,0,0,1 - 5%,
Dimethiconol,"Dimethiconol, Dimethiconol",Dimethiconol,Inactive,Low,,,Low,"Emollient, Texture Enhancer","Silicon-based emollient, perfect for dryness",0,0,0,0.2,0.2,Yes,Yes,Yes,Yes,Yes,Yes,Yes,Yes,Yes,Yes,Yes,Yes,Yes,Yes,Yes,Yes,Yes,Yes,Yes,Yes,Yes,No,Yes,Yes,Yes,Yes,Yes,Yes,Yes,Yes,0.2,,0,,0,,0,Forms a protective barrier on the skin to help prevent moisture loss.,0,"A silicone that provides a silky, smooth finish. It helps to control shine and can improve skin texture without adding greasiness, making it suitable for oily skin.",0,,0,,0.2,,0,,0.2,,0.2,,0,,0.2,0,0,0,0,0,0,0,0.2,0,0,0,0,0,0,0.2,0,0,0.2,0,0,0,0,0,0,0,0,0,0,0,1 - 5%,
C14-22 Alcohols,"C14-22 Alkanols, C14-22 Alcohols",C14-22 Alcohols,Inactive,Low,,,Low,"Emollient, Solvent",,1,0,0,0,0,Yes,Yes,Yes,Yes,Yes,Yes,Yes,Yes,Yes,Yes,Yes,Yes,Yes,Yes,Yes,Yes,Yes,Yes,Yes,Yes,Yes,No,Yes,Yes,Yes,Yes,Yes,Yes,Yes,Yes,0.2,,0,,0,,0.2,,0,,0,,0,,0,,0,,0.2,,0.2,,0.2,,0.2,0,0,0,0,0,0,0,0,0,0.2,0,0,0,0,0.2,0,0,0,0,0,0,0,0,0,0,0,0,0,0,1 - 5%,
Malachite Extract,"Malachite Powder Extract, Malachite",Malachite Extract,Active,Low,,,Low,Active,Antioxidant; beneficial for protecting skin from oxidative stress and reducing inflammation.,0,0.2,0.2,0.2,0.2,Yes,Yes,Yes,Yes,Yes,Yes,Yes,Yes,Yes,Yes,Yes,Yes,No,Yes,Yes,Yes,Yes,Yes,Yes,Yes,Yes,Yes,Yes,Yes,Yes,Yes,Yes,Yes,Yes,Yes,0.2,,0,,0,,0,,0.2,,0.2,,0.2,,0.2,,0.2,,0.2,,0.2,,0.2,,0,0,0,0,0,0,0,0,0,0,0.2,0.2,0,0,0,0.2,0,0,0.2,0,0.2,1,0,0,0,0,0,0.2,1,0,0.1 - 2%,
Triethylhexanoin,"Triethylhexanoin, Triethylhexanoin",Triethylhexanoin,Inactive,Low,,,Low,"Emollient, Occlusive Agent"," Emollient; generally neutral, helps in moisturizing and improving skin texture.",0,0,0,0.2,0.2,Yes,Yes,Yes,Yes,Yes,Yes,Yes,Yes,Yes,Yes,Yes,Yes,Yes,Yes,Yes,Yes,Yes,Yes,Yes,Yes,Yes,No,Yes,Yes,Yes,Yes,Yes,Yes,Yes,Yes,0,,0,,0,,0.2,,0.2,,0,,0,,0,,0,,0.2,,0.2,,0,,0.2,0,0,0,0,0,0,0,0,0,0,0,0,0,0,0.2,0,0,0,0,0,0,0,0,0,0,0,0,0,0,1 - 5%,
Trisodium EDTA,"EDTA, Trisodium Ethylenediaminetetraacetate",Trisodium EDTA,Inactive,Low,,,Low,Chelating Agent,"Chelating agent; generally neutral, helps in stabilizing formulations without significant impact on rosacea.",0,0,0,0,0,Yes,Yes,Yes,Yes,Yes,Yes,Yes,Yes,Yes,Yes,Yes,Yes,Yes,Yes,Yes,Yes,Yes,Yes,Yes,Yes,Yes,No,Yes,Yes,Yes,Yes,Yes,Yes,Yes,Yes,0,,0,,0,,0,,0,,0,,0,,0,,0,,0,,0,,0,,0,0,0,0,0,0,0,0,0,0,0,0,0,0,0,0,0,0,0,0,0,0,0,0,0,0,0,0,0,0,0.1 - 2%,
Arachidyl Glucoside,"Arachidyl Glucoside, Arachidyl Glucoside",Arachidyl Glucoside,Inactive,Low,,,Low,"Emulsifier, Emollient","Emulsifier; generally neutral, helps in blending ingredients and maintaining hydration.",0,0,0,0.2,0.2,Yes,Yes,Yes,Yes,Yes,Yes,Yes,Yes,Yes,Yes,Yes,Yes,No,Yes,Yes,Yes,Yes,Yes,Yes,Yes,Yes,No,Yes,Yes,Yes,Yes,Yes,Yes,Yes,Yes,0,,0,,0,,0.2,,0.2,,0,,0,,0,,0,,0.2,,0.2,,0,,0.2,0,0,0,0,0,0,0,0,0,0,0,0,0,0,0.2,0,0,0,0,0,0,0,0,0,0,0,0,0,0,1 - 5%,
PEG-100 Stearate,"Polyethylene Glycol-100 Stearate, PEG-100 Stearate",PEG-100 Stearate,Inactive,Low,,,Low,Emulsifier,,0,0,0,0,0,Yes,Yes,Yes,Yes,Yes,Yes,Yes,Yes,Yes,No,No,No,Yes,Yes,Yes,Yes,Yes,Yes,Yes,Yes,Yes,No,Yes,Yes,Yes,Yes,Yes,Yes,Yes,Yes,-0.2,,0,,-0.2,,0,,-0.2,,0,,0,,-0.2,,0,,0,,0,,-0.2,,0,0,0,0,0,0,0,0,0,-0.2,-0.2,0,0,0,0,0,0,0,-0.2,0,0,0,0,0,0,0,0,0,0,0,1 - 5%,
Dimethicone Crosspolymer,"Dimethicone Crosspolymer, Dimethicone/PEG-10/15 Crosspolymer",Dimethicone Crosspolymer,Inactive,Low,,,Low,"Emollient, Texture Enhancer", Silicone-based; provides a smooth texture and helps with moisture retention; generally neutral but can be occlusive for sensitive skin.,0,0,0,0.2,0.2,Yes,Yes,Yes,Yes,Yes,Yes,Yes,Yes,Yes,Yes,Yes,Yes,Yes,Yes,Yes,Yes,Yes,Yes,Yes,Yes,Yes,No,Yes,Yes,Yes,Yes,Yes,Yes,Yes,Yes,0,,0,,0,,1,Creates a breathable film on the skin to lock in moisture and improve hydration.,0,"A silicone polymer that provides a soft, matte finish. It helps absorb excess oil and reduces shine while improving the feel of the product on the skin.",0,,0,,0.2,,0,,0.2,,0.2,,0,,1,0,0,0,0,0,0,0,0.2,0,0,0,0,0,0,0.2,0,0,0.2,0,0,0,0,0,0,0,0,0,0,1,1 - 5%,Yes
C12-15 Alkyl Benzoate,"C12-15 Alkyl Benzoate, C12-15 Benzoate",C12-15 Alkyl Benzoate,Inactive,Low,,,Low,"Emollient, Solvent","Emollient; generally neutral to beneficial, helps in providing smoothness and hydration.",1,0,0.2,0.2,0.2,Yes,Yes,Yes,Yes,Yes,Yes,Yes,Yes,Yes,Yes,Yes,Yes,Yes,Yes,Yes,Yes,Yes,Yes,Yes,Yes,Yes,No,Yes,Yes,Yes,Yes,Yes,Yes,Yes,Yes,0,,0,,0,,0.2,,0,,0,,0,,0,,0,,0.2,,0.2,,0,,0.2,0,0,0,0,0,0,0,0,0,0,0,0,0,0,0.2,0,0,0,0,0,0,0,0,0,0,0,0,0,0,1 - 5%,
Imperata Cylindrica (Cogon Grass) Root Extract,"Cogon Grass Extract, Imperata Cylindrica Extract",Imperata Cylindrica (Cogon Grass) Root Extract,Active,Low,,,Low,Active,,0,0.2,0.2,0.2,0.2,Yes,Yes,Yes,Yes,Yes,Yes,Yes,Yes,Yes,Yes,Yes,Yes,No,Yes,Yes,Yes,Yes,Yes,Yes,Yes,Yes,Yes,Yes,Yes,Yes,Yes,Yes,Yes,Yes,Yes,0.2,,0,,0.2,,0.2,,0.2,,0.2,,0.2,,0.2,,0.2,,0.2,,0.2,,0,,1,0,0.2,0,0,0,0,0,0,0.2,0,0.2,0,0,0,0.2,0,0,0.2,0,0.2,0,0,0,0,0,0,0.2,0,0,0.1 - 2%,
Methylpropanediol,"MPD, Methylpropanediol",Methylpropanediol,Inactive,Low,,,Low,Humectant,"Solvent and humectant; generally neutral, helps in maintaining moisture and stability.",0,0,0,0.2,0.2,Yes,Yes,Yes,Yes,Yes,Yes,Yes,Yes,Yes,Yes,Yes,Yes,Yes,Yes,Yes,Yes,Yes,Yes,Yes,Yes,Yes,No,Yes,Yes,Yes,Yes,Yes,Yes,Yes,Yes,0,,0.2,,0,,0,,0.2,,0,,0,,0,,0.2,,0,,0,,0,,0,0,0.2,0,0,0,0,0,0,0,0,0,0,0,0,0,0.2,0,0,0,0,0,0,0,0,0,0,0,0,0,1 - 5%,
Meadowfoam Estolide,"Meadowfoam Seed Oil Estolide, Meadowfoam Estolide",Meadowfoam Estolide,Active,Low,,,Low,"Emollient, Occlusive Agent",Fatty acids,1,0.2,0.2,0.2,0.2,Yes,Yes,Yes,Yes,Yes,Yes,Yes,Yes,Yes,Yes,Yes,Yes,No,Yes,Yes,Yes,Yes,Yes,Yes,Yes,Yes,No,Yes,Yes,Yes,Yes,Yes,Yes,Yes,Yes,0,,0,,0,,0.2,,0.2,,0.2,,0.2,,0,,0.2,,0.2,,0.2,,0.2,,0.2,1,0,0,0,0,0,0,0,0,0.2,0.2,0,0,0,0.2,0,0,0,0,0.2,0,0,0,0,0,0,0.2,0,0,1 - 5%,
Dipalmitoyl Hydroxyproline,"Dipalmitoyl Hydroxyproline, Dipalmitoyl Hydroxyproline",Dipalmitoyl Hydroxyproline,Active,Low,,,Low,Active,Peptide. Anti-aging and skin-repairing; beneficial for improving skin texture and reducing irritation.,0,0.2,0.2,0.2,0.2,Yes,Yes,Yes,Yes,Yes,Yes,Yes,Yes,Yes,Yes,Yes,Yes,No,Yes,Yes,Yes,Yes,Yes,Yes,Yes,Yes,No,Yes,Yes,Yes,Yes,Yes,Yes,Yes,Yes,0,,0,,0,,0,,0,,0.2,,0.2,,0.2,,0,,0.2,,0.2,,0,,0,0,0,0,0,0,0,0,0,0,0,0.2,0,0,0,0.2,0,0,0.2,1,0.2,0,0,0,0,0,0,0.2,0,0,0.1 - 2%,
Tribehenin,"Tribehenin, Tribehenin",Tribehenin,Active,Low,,,Low,"Emollient, Occlusive Agent","Emollient; generally neutral to beneficial, helps in moisturizing and smoothing the skin.",0,0,0,0.2,0.2,Yes,Yes,Yes,Yes,Yes,Yes,Yes,Yes,Yes,Yes,Yes,Yes,No,Yes,Yes,Yes,Yes,Yes,Yes,Yes,Yes,No,Yes,Yes,Yes,Yes,Yes,Yes,Yes,Yes,0,,0,,0,,0.2,,0,,0,,0,,0,,0,,0.2,,0.2,,0.2,,0,0.2,0,0,0,0,0,0,0,0,0.2,0,0,0,0,0.2,0,0,0,0,0,0,0,0,0,0,0,0,0,0,1 - 5%,
Collagen Amino Acids,"Collagen Peptides, Collagen Amino Acids",Collagen Amino Acids,Active,Low,,,Low,Active,,0,0.2,0.2,0.2,0.2,Yes,Yes,Yes,Yes,Yes,Yes,Yes,Yes,Yes,Yes,Yes,Yes,No,Yes,Yes,Yes,Yes,Yes,Yes,No,Yes,No,Yes,Yes,Yes,Yes,Yes,Yes,Yes,Yes,0.2,,0,,0,,0.2,,0.2,,1,"Collagen amino acids are essential for the synthesis of collagen, a protein that provides structure and elasticity to the skin. Supplementing the skin with collagen amino acids can help improve skin texture and reduce the appearance of fine lines and wrinkles by supporting the skin's natural collagen production.",1,"As collagen is a key component of skin elasticity and firmness, providing collagen amino acids can help maintain and restore these properties. By promoting collagen synthesis and improving overall skin hydration, collagen amino acids contribute to a firmer, more elastic skin appearance.",0.2,,0.2,,0.2,,0.2,,0.2,,0,0,0,0,0,0,0,0,0,0,0.2,1,0,0,0,0.2,0,0,0.2,1,1,0,0,0,0,0,0,1,0,0,1 - 5%,Yes
Ceramide NG,"Ceramide NG, Ceramide N-G",Ceramide NG,Active,Low,,,Low,"Emollient, Occlusive Agent",,0,0.2,1,1,1,Yes,Yes,Yes,Yes,Yes,Yes,Yes,Yes,Yes,Yes,Yes,Yes,No,Yes,Yes,Yes,Yes,Yes,Yes,No,Yes,No,Yes,Yes,Yes,Yes,Yes,Yes,Yes,Yes,1,"Ceramide NG reinforces the skin barrier and helps reduce irritation, making it beneficial for managing rosacea.",0,,0.2,,1,"A lipid that reinforces the skin's barrier function, effectively reducing dryness and retaining moisture.",1,"Ceramide NG is a lipid that helps restore the skin barrier and retain moisture. By improving hydration, it can help balance oil production, reducing shine and preventing the skin from becoming overly oily or dry. Its barrier-repairing properties make it beneficial for maintaining overall skin health.",1,Ceramides are essential for maintaining the skin barrier and hydration. They help improve skin elasticity and firmness by preventing moisture loss and supporting the skin's structural integrity,1,Ceramides are essential for maintaining the skin barrier and hydration. They help improve skin elasticity and firmness by preventing moisture loss and supporting the skin's structural integrity,0.2,,0.2,,0.2,,0.2,,0.2,,1,0,0,0,0,0,0,0,1,0.2,0.2,1,0,0,0,0.2,0,0,0.2,0,1,0,0,0,0,0,0,1,0,1,0.5 - 2%,Yes
PEG-10 Phytosterol,"PEG-10 Phytosterol, PEG-10 Phytosterol",PEG-10 Phytosterol,Inactive,Low,,,Low,Emulsifier,,0,0,0,0.2,0.2,Yes,Yes,Yes,Yes,Yes,Yes,Yes,Yes,Yes,No,No,No,Yes,Yes,Yes,Yes,Yes,Yes,Yes,Yes,Yes,No,Yes,Yes,Yes,Yes,Yes,Yes,Yes,Yes,-0.2,,0,,-0.2,,0,,0,,0,,0,,-0.2,,0,,0.2,,0.2,,0,,1,0,0,0,0,0,0,0,0,-0.2,0,0,0,0,0,0.2,0,0,-0.2,0,0,0,0,0,0,0,0,0,0,0,1 - 5%,
