Hibiscus Oil,"Hibiscus Extract, Hibiscus Flower Oil, Hibiscus Sabdariffa Oil, Roselle Oil, Hibiscus Seed Oil",Hibiscus Sabdariffa Flower Oil,Active,Low Risk,Single,0,Low Risk,"Emollient, Active","Skin barrier protection, Moisturizing, Soothing",0,1,0.2,0.2,0.2,Yes,Yes,Yes,Yes,Yes,Yes,Yes,Yes,Yes,Yes,Yes,Yes,No,Yes,Yes,Yes,Yes,Yes,Yes,Yes,Yes,Yes,Yes,Yes,Yes,Yes,Yes,Yes,Yes,No,0.2,,0,,0,,0.2,,0.2,,1,"Hibiscus oil is rich in antioxidants and fatty acids that help to nourish the skin and reduce the appearance of fine lines and wrinkles. It also helps to improve skin elasticity and smoothness, promoting a more youthful appearance.",0.2,,0.2,,0,,0.2,,0.2,,0,,0.2,0,0,0,0,0,0,0,0,0,0,1,0,0,0,0.2,0,0,0.2,1,0.2,0,0,0,0,0,0,1,1,0,1 - 5%,Yes
Hibiscus Water,"Hibiscus Extract, Hibiscus Flower Water, Hibiscus Sabdariffa Extract, Hibiscus Floral Water, Hibiscus Water",Hibiscus Sabdariffa Flower Water,Active,Low Risk,Single,0,Low Risk,"Active, Humectant","Hydrating and soothing, with anti-inflammatory properties that help reduce redness and improve skin appearance.",0,0.2,0.2,0.2,0.2,Yes,Yes,Yes,Yes,Yes,Yes,Yes,Yes,Yes,Yes,Yes,Yes,No,Yes,Yes,Yes,Yes,Yes,Yes,Yes,Yes,Yes,Yes,Yes,Yes,Yes,Yes,Yes,Yes,No,0,,0.2,,0,,0.2,,0.2,,0.2,,0.2,,0.2,,0.2,,0.2,,0.2,,0.2,,0.2,0,0,0,0,0,0,0,0,0,0.2,0.2,0,0,0,0.2,0.2,0,0.2,0,0.2,0,0,0,0,0,0,0.2,0,0,1 - 5%,
Sea Buckthorn,"Hippophae Rhamnoides Oil, Sea Buckthorn Berry Oil, Hippophae Oil, Sea Buckthorn Extract, Hippophae Rhamnoides (Seabuckthorn) Berries Extract, Hippophae Rhamnoides (Sea Buckthorn) Fruit Extract",Hippophae Rhamnoides Extract,Active,Low Risk,Single,0,Low Risk,"Emollient, Active",Antioxidant,0,1,0.2,-0.2,0.2,Yes,Yes,Yes,Yes,Yes,Yes,Yes,Yes,Yes,Yes,Yes,Yes,No,No,Yes,Yes,Yes,Yes,Yes,Yes,Yes,Yes,No,Yes,Yes,Yes,Yes,Yes,Yes,No,0.2,"Sea buckthorn is rich in vitamins and essential fatty acids that help heal and soothe the skin. It’s particularly effective in reducing redness and inflammation, making it beneficial for rosacea-prone skin.",0.2,,0.2,"Sea buckthorn is rich in vitamins and essential fatty acids, which help reduce inflammation and promote healing. It has antibacterial properties that can help prevent acne and reduce the severity of breakouts. Sea buckthorn also helps to nourish the skin and improve its overall texture, making it a valuable ingredient for acne-prone skin.",0.2,,-0.2,,1,Sea buckthorn is rich in vitamins and essential fatty acids that help to nourish and regenerate the skin. It helps to reduce the appearance of fine lines and wrinkles by promoting collagen production and protecting the skin from environmental damage.,1,"Rich in vitamins and essential fatty acids, it supports collagen production and improves skin elasticity, helping to firm the skin.",0.2,Sea buckthorn is rich in vitamins and fatty acids that promote skin regeneration and improve texture. It helps minimize the appearance of pores and smooth uneven skin for a more refined complexion.,0,,0.2,"Sea buckthorn is rich in vitamins and antioxidants that nourish the skin and promote a healthy, glowing complexion. It helps to reduce dullness by improving skin tone and texture.",0.2,,0,,0,1,0,0,0,0,0,1,0,0.2,0,1,0,0,0,0.2,0.2,0,0.2,0,1,0,0,0,0,0,0,1,0,0,1 - 5%,Moderately effective
Hippophaë Rhamnoides Oil,"Hippophae Rhamnoides Oil, Sea Buckthorn Oil, Sea Buckthorn Berry Oil, Seaberry Oil, Buckthorn Oil, Hippophae Rhamnoides Fruit Oil, Sea Buckthorn Oil, Hippophae Oil, Hippophae Rhamnoides (Seabuckthorn) Seed Oil",Hippophae Rhamnoides Oil,Active,Low Risk,Single,0,Low Risk,"Emollient, Active",Antioxidant,1,1,0.2,-0.2,0.2,Yes,Yes,Yes,Yes,Yes,Yes,Yes,Yes,Yes,Yes,Yes,Yes,No,Yes,Yes,Yes,Yes,Yes,Yes,Yes,Yes,Yes,Yes,Yes,Yes,Yes,Yes,Yes,Yes,No,0.2,"Also known as sea buckthorn oil, this ingredient is packed with antioxidants and anti-inflammatory properties. It helps reduce redness and promote skin healing, making it ideal for treating rosacea.",0.2,,0.2,"Sea buckthorn is rich in vitamins and essential fatty acids, which help reduce inflammation and promote healing. It has antibacterial properties that can help prevent acne and reduce the severity of breakouts. Sea buckthorn also helps to nourish the skin and improve its overall texture, making it a valuable ingredient for acne-prone skin.",0.2,,-0.2,,1,"Sea buckthorn oil is packed with antioxidants and vitamins that help to reduce the appearance of fine lines and wrinkles. It promotes skin regeneration and improves elasticity, making the skin look firmer and smoother.",0.2,,0.2,Sea buckthorn oil is packed with antioxidants and essential fatty acids that help smooth uneven skin texture and reduce the appearance of pores. It also promotes skin healing and regeneration.,0,,0.2,"Sea buckthorn oil is packed with nutrients that revitalize the skin, reducing dullness and improving radiance. Its high vitamin C content helps to brighten the skin and even out tone.",0.2,,0,,0.2,0,0,0,0,0,0,0,0,0.2,0,1,0,0,0,0.2,0.2,0,0.2,1,0.2,0,0,0,0,0,0,1,0,0,1 - 5%,Moderately effective
Hops,"Humulus lupulus extract, Hops extract, Lupulin, Hops Flower Extract, Hops Cone Extract, Humulus Lupulus (Hops) Strobile",Humulus Lupulus (Hops) Extract,Active,Low Risk,Single,0,Low Risk,"Active, Antioxidant",Antioxidant,0,0.2,0.2,0.2,0.2,Yes,Yes,Yes,Yes,Yes,Yes,Yes,Yes,Yes,Yes,Yes,Yes,No,No,Yes,Yes,Yes,Yes,Yes,Yes,Yes,Yes,Yes,Yes,Yes,Yes,Yes,Yes,Yes,No,0,,0.2,,0.2,,0.2,,0.2,,0,,0,,0.2,,0.2,,0.2,,0.2,,0,,0,0,0,0,1,0.2,0,0,0,0.2,0,0,0,0,0,0.2,0.2,0,0.2,1,0,0,0,0,0,0,0,0,0,0,0.5 - 2%,
Hydrogenated Farnesene,"Squalane, Hydrogenated Squalene, Farnesane, Hydrogenated Terpene, Squalane Oil",Hydrogenated Farnesene,Inactive,Low Risk,Single,0,Low Risk,"Emollient, Texture Enhancer","Emollient, Skin barrier protection",1,0.2,0.2,-0.2,0.2,Yes,Yes,Yes,Yes,Yes,Yes,Yes,Yes,Yes,Yes,Yes,Yes,Yes,Yes,Yes,No,No,No,Yes,Yes,Yes,Yes,Yes,Yes,Yes,Yes,Yes,Yes,Yes,Yes,0,,0,,0,,0.2,,-0.2,,0.2,,0.2,,0.2,,0,,0.2,,0,,0,,0.2,0,0,0,0,0.2,0,0,0,0,0,0.2,0,0,0,0.2,0,0,0.2,0,0.2,0,0,0,0,0,0,0.2,0,0,1 - 5%,
Hydrogenated Lecithin,"Lecithin, Hydrogenated Phosphatidylcholine, Hydrogenated Soy Lecithin, Hydrolyzed Lecithin, Hydrogenated Lecithin Solution",Hydrogenated Lecithin,Inactive,Low Risk,Single,0,Low Risk,"Emollient, Emulsifier","Emollient, Skin barrier protection, Moisturizing",1,0.2,0.2,0,0.2,Yes,Yes,Yes,Yes,Yes,Yes,Yes,Yes,Yes,Yes,Yes,Yes,No,Yes,Yes,Yes,Yes,Yes,Yes,Yes/No,Yes,No,Yes,Yes/No,Yes,Yes,Yes,Yes,Yes,Yes,0,,0,,0,,0.2,,0,,0.2,,0.2,,0.2,,0,,0.2,,0.2,,0.2,,0.2,0,0,0,0,0,0,0,0,0,0.2,0.2,0,0,0,0.2,0,0,0.2,0,0.2,0,0,0,0,0,0,0.2,0,0,1 - 5%,
Hydrogenated Palm Glycerides,"Palm Glycerides, Hydrogenated Palm Oil, Palm Oil Glycerides, Hydrogenated Palm Kernel Glycerides",Hydrogenated Palm Glycerides,Inactive,Low Risk,Compound,"Palm Glycerides, Fatty Acids",Low Risk,"Emollient, Texture Enhancer","Emollient, Skin barrier protection",3,0.2,0.2,-1,-0.2,Yes,Yes,Yes,Yes,Yes,Yes,Yes,Yes,Yes,No,No,No,No,No,Yes,Yes,Yes,Yes,Yes,Yes,Yes,Yes,Yes,Yes,Yes,Yes,Yes,Yes,Yes,Yes,0.2,,-0.2,,-0.2,,0.2,,-1,,0.2,,0,,0,,0,,0.2,,0,,0,,0.2,0.2,0,0,0,0,0,0,0,-0.2,0,0.2,0,0,0,0.2,-0.2,0,0,0,0,0,0,0,0,0,0,0.2,0,0,1 - 5%,
Hydrogenated Polyisobutene,"Polyisobutene, Synthetic squalane, Hydrogenated Isobutene, Hydrogenated Polybutene",Hydrogenated Polyisobutene,Inactive,Low Risk,Single,0,Low Risk,"Emollient, Texture Enhancer","Emollient, Skin barrier protection",1,0,0.2,0,0.2,Yes,Yes,Yes,Yes,Yes,Yes,Yes,Yes,Yes,Yes,Yes,Yes,Yes,Yes,Yes,Yes,Yes,Yes,Yes,Yes,Yes,No,Yes,Yes,Yes,Yes,Yes,Yes,Yes,Yes,0.2,,0,,0,,0.2,,0,,0.2,,0,,0.2,,0,,0.2,,0,,0,,0.2,0,0,0,0,0,0,0,0,0,0,0.2,0,0,0,0.2,0,0,0.2,0,0,0,0,0,0,0,0,0.2,0,0,1 - 5%,
Collagen,"Collagen, Hydrolyzed Collagen, Marine Collagen, Bovine Collagen",Hydrolyzed Collagen,Active,Low Risk,Single,0,Low Risk,Active,Improve skin elasticity and hydration,0,0,0.2,-0.2,0.2,Yes,Yes,Yes,Yes,Yes,Yes,Yes,Yes,Yes,Yes,Yes,Yes,No,No,Yes,Yes,Yes,Yes,No,No,Yes,No,Yes,Yes,Yes,Yes,Yes,Yes,Yes,Yes,0.2,,0,,0,,0.2,,-0.2,,0,,0,,0,,0,,0.2,,0,,0,,0,0,0,0,0,0,0,0,0,0,0,0,0,0,0,0.2,0,0,0,1,0,0,0,0,0,0,0,0,0,1,0.5 - 2%,
Hydrolyzed Sodium Hyaluronate,"Hyaluronic Acid, Sodium Hyaluronate, Hyaluronan, Hydrolyzed Hyaluronic Acid, Hydrolyzed Hyaluronan",Hydrolyzed Sodium Hyaluronate,Active,Low Risk,Single,0,Low Risk,"Active, Humectant",A smaller molecular form of hyaluronic acid that provides deep hydration and helps maintain skin moisture.,0,1,1,1,1,Yes,Yes,Yes,Yes,Yes,Yes,Yes,Yes,Yes,Yes,Yes,Yes,No,Yes,Yes,Yes,Yes,Yes,Yes,Yes,Yes,Yes,Yes,Yes,Yes,Yes,Yes,Yes,Yes,Yes,1,"Hydrolyzed Sodium Hyaluronate: A smaller molecule of hyaluronic acid that penetrates deeper into the skin, providing intense hydration and promoting skin barrier repair. It helps soothe and calm rosacea-prone skin by reducing dryness, irritation, and redness.",0.2,,0,,1,"Hydrolyzed Sodium Hyaluronate is a form of hyaluronic acid that penetrates deeply into the skin to provide intense hydration. It helps to plump and moisturize dry, dehydrated skin, making it soft and smooth.",0.2,Hydrolyzed sodium hyaluronate provides lightweight hydration that doesn’t add oil to the skin. It’s beneficial for oily skin as it helps maintain moisture balance and prevents dehydration.,1,"This form of hyaluronic acid penetrates deeply into the skin to provide intense hydration, plumping the skin and reducing the appearance of fine lines and wrinkles. It also helps to maintain the skin’s elasticity and smoothness by improving moisture retention.",0.2,"Provides deep hydration, plumping the skin and improving elasticity, helping to maintain firmness by keeping moisture balanced.",0.2,,0.2,,0.2,,0.2,,0.2,,0.2,0,1,0,0,0,0,0,1,0,0.2,1,0,0,0,0.2,0.2,0,0.2,0,0.2,0,0,0,0,0,0,1,0,0,0.1 - 2%,Yes
Hydroxyacetophenone,"4-Hydroxyacetophenone, p-Hydroxyacetophenone, 1-(4-Hydroxyphenyl)ethanone, Hydroxyacetophenone Crystal",Hydroxyacetophenone,Inactive,Low Risk,Single,0,Low Risk,"Preservative, Antioxidant, Stabilizer",Not a paraben. Not likely to cause irritation and acne.,0,0.2,0,0,0.2,Yes,Yes,Yes,Yes,Yes,Yes,Yes,Yes,Yes,Yes,Yes,Yes,Yes,Yes,Yes,Yes,Yes,Yes,Yes,Yes,Yes,Yes,Yes,Yes,Yes,Yes,Yes,Yes,Yes,Yes,0,,0,,0,,0,,0,,0.2,,0.2,,0,,0,,0.2,,0.2,,0,,0,0,0,0,0,1,0,0,0,0,0,0.2,0,0,0,0.2,0,1,0,0,0.2,0,0,0,0,0,0,0.2,1,0,0.1 - 1%,
St. John's Wort,"Hypericum perforatum extract, Hypericum extract, St. John's herb extract, St. John's Wort Extract",Hypericum Perforatum Extract,Active,Low Risk,Single,0,Moderate Risk,"Active, Antioxidant",Antioxidant,1,0.2,-0.2,0,0.2,Yes,Yes,Yes,Yes,No,No,Yes,Yes,Yes,Yes,Yes,Yes,No,No,Yes,Yes,Yes,Yes,Yes,Yes,Yes,Yes,Yes,Yes,Yes,Yes,Yes,Yes,Yes,Yes,-1,,0.2,,0.2,,-0.2,,0,,0,,0,,0.2,,0,,0.2,,-1,,0,,0,0,0,0,0,1,0,1,0,0.2,0,0,0,0,0,0.2,0.2,1,0.2,0,0,0,0,0,0,0,0,0,0,0,0.5 - 2%,
Inonotus Obliquus (Chaga Mushroom) Extract,"Chaga Extract, Birch Mushroom Extract, Inonotus Extract, Chaga Mushroom Extract, Inonotus Obliquus Powder",Inonotus Obliquus (Mushroom) Extract,Active,Low Risk,Single,0,Low Risk,"Active, Antioxidant",Antioxidant,0,1,0.2,0.2,0.2,Yes,Yes,Yes,Yes,Yes,Yes,Yes,Yes,Yes,Yes,Yes,Yes,No,No,Yes,Yes,Yes,Yes,Yes,Yes,Yes,Yes,Yes,Yes,Yes,Yes,Yes,Yes,Yes,Yes,0.2,,0.2,,0.2,,0.2,,0.2,,0.2,,1,"Rich in antioxidants, it protects the skin from environmental damage while promoting collagen production, restoring elasticity and firmness.",0.2,,0.2,,0.2,,0.2,,0.2,Chaga mushroom extract has powerful antioxidant and anti-inflammatory properties that help reduce the appearance of blemishes and calm irritated skin. It also promotes healing and protects the skin from environmental damage.,0,0,0,0,1,1,0,0,0,0.2,0.2,0.2,0,0,0,0.2,0.2,0,0.2,0,1,0,0,0,0,0,0,0.2,0,0,1 - 5%,Moderately effective
Isopropyl Palmitate,"Propylhexadecanoate, 1-Methylethyl hexadecanoate, Hexadecanoic acid isopropyl ester, Isopropyl Hexadecanoate",Isopropyl Palmitate,Inactive,Low Risk,Single,0,Moderate Risk,"Emollient, Texture Enhancer","Emollient, Skin barrier protection",2,0.2,0.2,-1,-1,Yes,Yes,Yes,Yes,No,No,Yes,Yes,No,No,No,No,Yes,Yes,Yes,Yes,Yes,Yes,Yes,Yes/No,Yes,No,Yes,Yes,Yes,Yes,Yes,Yes,Yes,Yes,-0.2,,0,,-6,,0.2,,-6,,0.2,,0.2,,-6,,-6,,0.2,,-1,,-6,,0.2,0,0,0,0,0,0,0,0,-6,-6,0.2,0,0,0,0.2,0,0,-6,0,0.2,0,0,0,0,0,0,0.2,0,0,1 - 5%,
Fresh jasmine blossoms,"Jasmine Flowers, Jasminum Flowers, Jasmine Petals, Jasmine Flower Extract, Jasminum Officinale (Jasmine) Flower/Leaf Extract",Jasminum Officinale (Jasmine) Flower Extract,Active,Moderate Risk,Single,0,High Risk,"Fragrance, Active",Can be irritating for sensitive skin,0,0.2,-0.2,-0.2,0.2,Yes,Yes,No,No,No,No,Yes,Yes,Yes,Yes,Yes,Yes,Yes,Yes,Yes,Yes,Yes,Yes,Yes,Yes,Yes,Yes,Yes,Yes,Yes,Yes,Yes,Yes,Yes,No,-1,,-1,,0,,-0.2,,-0.2,,0,,0,,0.2,,-1,,-1,,-1,,0,,0,0,0,0,1,0.2,0,0.2,0,0,0,0,0,0,0,-1,-1,0,0.2,0,0,0,0,1,0,0,0,0,0,0,0.1 - 1%,
Jojoba Esters,"Jojoba oil esters, Hydrogenated jojoba oil, Jojoba wax esters, Jojoba Butter, Jojoba Wax, Jojoba Oil/Macadamia Seed Oil Esters",Jojoba Esters,Inactive,Low Risk,Compound,"Jojoba Oil, Fatty Acid Esters",Low Risk,"Emollient, Texture Enhancer","Emollient, Skin barrier protection",1,1,1,1,1,Yes,Yes,Yes,Yes,Yes,Yes,Yes,Yes,Yes,Yes,Yes,Yes,Yes,Yes,Yes,Yes,Yes,Yes,Yes,Yes,Yes,Yes,Yes,Yes,Yes,Yes,Yes,Yes,Yes,Yes,0.2,,0,,0,,1,"Jojoba Esters mimic the skin’s natural oils, providing lightweight hydration that helps to balance moisture levels in the skin. They’re effective in treating dryness without clogging pores, leaving the skin soft and hydrated.",1,"Jojoba esters mimic the skin’s natural sebum, providing hydration while helping regulate oil production. They’re effective in balancing oily skin and reducing shine.",0.2,,0.2,,1,"Jojoba esters mimic the skin’s natural sebum, helping balance oil production and smooth uneven texture. They also help minimize the appearance of pores by keeping the skin hydrated and balanced.",0,,0.2,,0,,0,,1,0,0,0,0,0,0,1,0,0,0,0.2,0,0,0,0.2,0,0,1,0,0.2,0,0,0,0,0,0,0.2,0,0,1 - 10%,Moderately effective
Lauryl Laurate,"Dodecyl laurate, Lauric acid dodecyl ester, Dodecanoic acid dodecyl ester, Lauryl Ester, Lauryl Ester Wax",Lauryl Laurate,Inactive,Low Risk,Single,0,Low Risk,"Emollient, Texture Enhancer","Emollient, Skin barrier protection",4,0.2,0.2,-0.2,0,Yes,Yes,Yes,Yes,Yes,Yes,Yes,Yes,No,No,No,No,Yes,Yes,Yes,Yes,Yes,Yes,Yes,Yes,Yes,No,Yes,Yes,Yes,Yes,Yes,Yes,Yes,Yes,0,,-1,,-1,,0.2,,-0.2,,0.2,,0.2,,-0.2,,-1,,0.2,,0,,-1,,0.2,0,0,0,0,0,0,0,0,-1,-1,0.2,0,0,0,0.2,-1,0,-0.2,0,0.2,0,0,0,0,0,0,0.2,0,0,1 - 5%,
Fresh lavender flowers,"Lavender, Lavandula, Lavandula Angustifolia, Lavender Flower Extract, Lavandula Flower Extract, Lavandula Angustifolia (Lavender) Flower Oil , Lavandula Angustifolia Extract, Lavender Extract, Lavandula Extract, Lavandula Angustifolia (Lavender) Flower/Leaf/Stem Extract",Lavandula Angustifolia (Lavender) Flower Extract,Active,Moderate Risk,Single,0,High Risk,"Fragrance, Active",Can be irritating for sensitive skin,0,0.2,-0.2,1,0.2,Yes,Yes,No,No,No,No,Yes,Yes,Yes,Yes,Yes,Yes,Yes,Yes,Yes,Yes,Yes,Yes,Yes,Yes,Yes,Yes,Yes,Yes,Yes,Yes,Yes,Yes,No,No,-1,,-1,,0,,-0.2,,0.2,Lavender flowers have astringent properties that help balance oil production and soothe the skin. They’re effective in calming oily skin and preventing breakouts.,0.2,,0.2,,0.2,,-1,,0.2,,-1,,0.2,,0,0,0,0,1,1,0,1,0,0,0.2,0.2,0,0,0,0.2,-1,0,0.2,0,0.2,0,0,0,0,0,0,0.2,0,0,0.1 - 1%,
Lavender Hydrosol,"Lavender Water, Lavandula Angustifolia Flower Water, Lavender Floral Water",Lavandula Angustifolia (Lavender) Flower Water,Active,Moderate Risk,Single,0,Low Risk,"Fragrance, Active",Generally non-irritating,0,0.2,0.2,1,0.2,Yes,Yes,Yes,Yes,Yes,Yes,Yes,Yes,Yes,Yes,Yes,Yes,Yes,Yes,Yes,Yes,Yes,Yes,Yes,Yes,Yes,Yes,Yes,Yes,Yes,Yes,Yes,Yes,Yes,No,0,,-1,,0,,0.2,,0.2,Lavender hydrosol helps tone and balance oily skin by regulating sebum production. It’s effective in reducing shine and keeping the skin clear.,0.2,,0,,0.2,,0.2,,0.2,,0,,0,,0,0,0.2,0,1,1,0,0,0,0,0,0.2,0,0,0,0.2,-1,0,0.2,0,0,0,0,1,0,0,0,0.2,0,0,1 - 5%,
Lavandula Angustifolia Oil / Lavender Oil,"Lavandula Angustifolia (Lavender) Oil, Lavandula Oil, Lavender Essential Oil, Lavender essential oil, Lavender oil, Lavandula oil, Lavandula Anguvstifolia (Lavender) Essential Oil",Lavandula Angustifolia (Lavender) Oil,Active,Moderate Risk,Single,0,High Risk,"Fragrance, Active","Anti-inflammatory, Soothing, Can be irritating for sensitive skin",1,0.2,0.2,1,1,Yes,Yes,No,No,No,No,Yes,Yes,Yes,Yes,Yes,Yes,Yes,Yes,Yes,Yes,Yes,Yes,Yes,Yes,Yes,Yes,Yes,Yes,Yes,Yes,Yes,Yes,No,No,-1,,-1,,0.2,,0.2,,0.2,Lavender oil has antibacterial and balancing properties that help regulate oil production and prevent acne. It’s effective in calming oily skin and reducing excess sebum.,0.2,,0,,0.2,,-1,,0.2,,-1,,0,,0,0,0,0,1,1,0,1,0,0.2,0,0.2,0,0,0,0.2,-1,0,0.2,0,0,0,0,0,0,0,0,0.2,0,0,0.1 - 2%,
Organic lavender essential oil,"Organic Lavender Oil, Organic Lavandula Oil",Organic Lavandula Angustifolia (Lavender) Oil,Active,Moderate Risk,Single,0,Moderate Risk,"Fragrance, Active","Soothing, Anti-inflammatory",#N/A,0.2,1,1,1,Yes,Yes,Yes,Yes,No,No,Yes,Yes,Yes,Yes,Yes,Yes,Yes,Yes,Yes,Yes,Yes,Yes,Yes,Yes,Yes,Yes,Yes,Yes,Yes,Yes,Yes,Yes,No,No,-1,,0.2,"Organic lavender essential oil helps to soothe the skin and promote healing. It can support the treatment of hyperpigmentation by calming the skin and preventing further irritation, which could lead to post-inflammatory hyperpigmentation.",0.2,,0.2,"Organic Lavender Essential Oil has soothing and hydrating properties that help to calm dry, irritated skin. It provides lightweight moisture and helps to restore the skin’s natural balance.",0.2,"Organic lavender oil offers the same benefits as regular lavender oil, with added purity. It helps balance oil production and soothe oily skin.",0.2,,0,,0.2,,0.2,,0.2,,-1,,0.2,,0,0,0,0,1,1,0,1,0,0.2,0.2,0.2,0,0,0,0.2,0.2,0,0.2,0,0,0,0,0,0,0,0,0.2,0,0,0.1 - 1%,
Lavandula Hybrida Oil,"Lavender Oil, Lavandin Oil, Lavandula Hybrida Oil, Hybrid Lavender Oil",Lavandula Hybrida Oil,Active,Moderate Risk,Single,0,Low Risk,"Fragrance, Active","Anti-inflammatory, Soothing, Can be irritating for sensitive skin",0,0.2,0.2,1,1,Yes,Yes,Yes,Yes,Yes,Yes,Yes,Yes,Yes,Yes,Yes,Yes,Yes,Yes,Yes,Yes,Yes,Yes,Yes,Yes,Yes,Yes,Yes,Yes,Yes,Yes,Yes,Yes,No,No,-1,,-1,,0,,0.2,,0.2,"Lavandula Hybrida Oil has similar properties to lavender oil, helping balance sebum production and reduce shine. It’s effective in calming oily skin and preventing acne.",0.2,,0,,0.2,,0.2,,0,,0.2,,0,,0,0,0,0,1,0,0,0,0,0,0,0.2,0,0,0,0,-1,1,0.2,0,0,0,0,0,0,0,0,0.2,0,0,0.1 - 2%,
Lecithin,"Phosphatidylcholine, Soy lecithin, Lecithin, Egg Lecithin, Sunflower Lecithin",Lecithin,Inactive,Low Risk,Single,0,Low Risk,"Emulsifier, Emollient","Skin barrier protection, Moisturizing, Emulsifying",2,0.2,0.2,0.2,0.2,Yes,Yes,Yes,Yes,Yes,Yes,Yes,Yes,Yes,Yes,Yes,Yes,No,Yes,Yes,Yes,Yes,Yes,Yes,Yes/No,Yes,No,Yes,No,Yes,Yes,Yes,Yes,Yes,Yes,0,,0,,0,,0.2,,0.2,,0.2,,0.2,,0.2,,0.2,,0.2,,0.2,,0.2,,0.2,0.2,0,0,0,0,0,0,0,0,0.2,0.2,0,0,0,0.2,0,0,0.2,0,0.2,0,0,0,0,0,0,0.2,0,1,1 - 5%,
Leucidal Liquid Advanced Aloe,"Leucidal Aloe, Aloe Ferment, Lactobacillus/Aloe Barbadensis Ferment, Leuconostoc/Radish Root Ferment Filtrate Aloe Blend",Leuconostoc/Radish Root Ferment Filtrate (and) Aloe Barbadensis Leaf Juice,Active,Low Risk,Compound,"Leuconostoc/Radish Root Ferment Filtrate, Aloe Vera Leaf Juice",Low Risk,"Preservative, Humectant",Not a paraben. Not likely to cause irritation and acne.,0,0.2,0,0,0.2,Yes,Yes,Yes,Yes,Yes,Yes,Yes,Yes,Yes,Yes,Yes,Yes,Yes,Yes,Yes,Yes,Yes,Yes,Yes,Yes,Yes,Yes,Yes,Yes,Yes,Yes,Yes,Yes,Yes,Yes,0,,0,,0,,0,,0,,0.2,,0,,0,,0,,0,,0,,0,,0,0,0,0,0,0.2,0,0,0,0,0,0.2,0,0,0,0,0,0,0,0,0,0,0,0,0,1,0,0.2,0,1,1 - 5%,
Limnanthes Alba (Meadowfoam) Seed Oil,"Meadowfoam Oil, Limnanthes Alba Oil, Meadowfoam Seed Oil, Limnanthes Alba Seed Oil",Limnanthes Alba (Meadowfoam) Seed Oil,Active,Low Risk,Single,0,Low Risk,"Emollient, Texture Enhancer","Skin barrier protection, Moisturizing, Antioxidant",1,1,1,1,0.2,Yes,Yes,Yes,Yes,Yes,Yes,Yes,Yes,Yes,Yes,Yes,Yes,No,Yes,Yes,Yes,Yes,Yes,Yes,Yes,Yes,Yes,Yes,Yes,Yes,Yes,Yes,Yes,Yes,No,0.2,,0,Magnesium Ascorbyl Phosphate is a stable form of Vitamin C that helps brighten the skin and reduce the appearance of hyperpigmentation by inhibiting melanin production. It’s gentle and effective for treating dark spots and promoting an even skin tone.,0,,1,"Meadowfoam Seed Oil is rich in fatty acids and provides long-lasting hydration to the skin. It helps to lock in moisture and prevent dehydration, making it effective in treating dry skin.",0.2,"Meadowfoam seed oil helps balance sebum production and provides lightweight hydration, making it suitable for oily skin. It helps keep the skin clear and free of excess shine.",0.2,,0.2,,0.2,"Meadowfoam seed oil helps balance oil production and provides lightweight hydration, which smooths uneven texture and reduces the appearance of pores.",0,,0.2,,0.2,,0,,1,1,0,0,0,0.2,0,0,0,0,0,0.2,0,0,0,0.2,0,0,0.2,0,0.2,0,0,0,0,0,0,0.2,0,0,1 - 5%,Moderately effective
Limonene,"Limonene, D-Limonene, (R)-4-Isopropenyl-1-methylcyclohexene",Limonene,Active,High Risk,Single,0,High Risk,Fragrance,Can be irritating for sensitive skin,1,0,-1,-1,-1,Yes,Yes,No,No,No,No,Yes,Yes,No,No,No,No,No,No,No,No,No,No,Yes,Yes,Yes,Yes,Yes,Yes,Yes,Yes,No,Yes,Yes,No,-6,,-1,,-1,,-6,,-1,,-1,,-1,,-1,,-1,,-1,,-6,,-1,,0,0,0,0,0,0,0,0,0,-1,-1,-1,0,0,0,-1,-1,0,-1,0,-1,0,0,0,0,0,0,-1,0,0,0.1 - 0.5%,
Linalool,"Linalool, 3,7-Dimethylocta-1,6-dien-3-ol, 2,6-Dimethyl-2,7-octadien-6-ol",Linalool,Active,High Risk,Single,0,High Risk,Fragrance,Can be irritating for sensitive skin,0,0,-1,-1,-1,Yes,Yes,No,No,No,No,Yes,Yes,No,No,No,No,No,No,Yes,Yes,Yes,No,Yes,Yes,Yes,Yes,Yes,Yes,Yes,Yes,Yes,Yes,No,No,-6,,-1,,-1,,-6,,-1,,-1,,-1,,-1,,-1,,-1,,-6,,-1,,0,0,0,0,0,0,0,0,0,-1,-1,-1,0,0,0,-1,-1,0,-1,0,-1,0,0,0,0,0,0,-1,0,0,0.1 - 0.5%,
Linum Usitatissimum (Linseed) Seed Extract,"Flaxseed extract, Flax extract, Linseed Extract, Linum Usitatissimum Seed Extract",Linum Usitatissimum (Linseed) Seed Extract,Active,Low Risk,Single,0,Low Risk,"Active, Antioxidant",Antioxidant,0,0.2,0.2,-0.2,0.2,Yes,Yes,Yes,Yes,Yes,Yes,Yes,Yes,Yes,Yes,Yes,Yes,No,Yes,Yes,Yes,Yes,Yes,Yes,Yes,Yes,Yes,Yes,Yes,Yes,Yes,Yes,Yes,Yes,No,0.2,,0.2,,0.2,,0.2,,-0.2,,0.2,,0.2,,0.2,,0.2,,0.2,,0.2,,0.2,,1,1,0,0,0,0,0,0,0,0.2,0.2,0.2,0,0,0,0.2,0.2,0,0.2,0,0.2,0,1,0,0,0,0,0.2,0,0,0.5 - 2%,
Flaxseed Oil,"Linseed oil, Flax oil, Linum usitatissimum seed oil, Flaxseed Oil",Linum Usitatissimum (Linseed) Seed Oil,Active,Low Risk,Single,0,Low Risk,Humectant,Contains omega-3 fatty acids that help reduce inflammation and support skin healing.,3,0.2,0.2,0,0.2,Yes,Yes,Yes,Yes,Yes,Yes,Yes,Yes,Yes,Yes,Yes,Yes,No,Yes,Yes,Yes,Yes,Yes,Yes,Yes,Yes,Yes,Yes,Yes,Yes,Yes,Yes,Yes,Yes,No,0.2,"Flaxseed Oil is rich in omega-3 fatty acids and has anti-inflammatory properties, which can be beneficial for managing rosacea. It helps to soothe irritated skin and reduce redness, while maintaining the skin’s moisture barrier. It is generally well-tolerated but should be patch-tested on sensitive skin.",0.2,,0,,0.2,,0,,0.2,,0.2,,0.2,,0.2,,0.2,"Flaxseed oil is rich in fatty acids that help to nourish and hydrate the skin, reducing the appearance of dullness. It improves skin texture and promotes a healthy, glowing complexion.",0,,0.2,,1,1,0,0,0,0,0,0,0,0,0.2,0.2,0,0,0,0.2,0.2,1,0.2,0,0.2,0,0,0,0,0,0,0.2,0,0,1 - 5%,
Macadamia Nut Oil,"Macadamia integrifolia seed oil, Macadamia ternifolia seed oil, Macadamia oil, Macadamia Nut Oil",Macadamia Integrifolia Seed Oil,Active,Low Risk,Single,0,Low Risk,"Emollient, Texture Enhancer","Skin barrier protection, Moisturizing",2,1,0.2,-0.2,0.2,Yes,Yes,Yes,Yes,Yes,Yes,Yes,Yes,Yes,Yes,Yes,Yes,No,Yes,Yes,Yes,Yes,Yes,Yes,Yes,Yes,Yes,No,Yes,Yes,Yes,Yes,Yes,Yes,No,0.2,,0,,0,,1,"A rich butter that is highly moisturizing and effective in treating dry skin. It forms a protective barrier, preventing moisture loss and deeply hydrating the skin.",-0.2,,0.2,,0.2,,-0.2,,0,,0.2,,0.2,,0,,1,1,0,0,0,0,0,1,0,0,0,0.2,0,0,0,0.2,0,0,-0.2,0,0.2,0,0,0,0,0,0,0.2,0,0,1 - 5%,Moderately effective
Magnesium Ascorbyl Phosphate,"MAP, Ascorbic Acid Magnesium Salt, Magnesium L-Ascorbyl-2-phosphate, Magnesium Vitamin C, Magnesium Ascorbyl Phosphate Solution",Magnesium Ascorbyl Phosphate,Active,Low Risk,Single,0,Low Risk,"Active, Antioxidant",Antioxidant,0,1,0.2,1,1,Yes,Yes,Yes,Yes,Yes,Yes,Yes,Yes,Yes,Yes,Yes,Yes,No,Yes,Yes,Yes,Yes,Yes,Yes,Yes,Yes,Yes,Yes,Yes,Yes,Yes,Yes,Yes,Yes,Yes,0.2,,0.2,,0.2,,0.2,,0.2,Magnesium Ascorbyl Phosphate is a stable form of Vitamin C that helps regulate sebum production and brighten the skin. It’s effective in reducing shine and preventing clogged pores.,1,"Magnesium Ascorbyl Phosphate is a stable form of Vitamin C that helps to stimulate collagen production and reduce the appearance of fine lines and wrinkles. It also brightens the skin and protects against environmental damage, making it an effective anti-aging ingredient.",1,"A stable form of Vitamin C that stimulates collagen production, improving elasticity and firmness, and provides antioxidant protection against environmental damage.",0.2,"A stable form of Vitamin C, Magnesium Ascorbyl Phosphate helps brighten the skin, smooth uneven texture, and minimize the appearance of pores. It also protects the skin from environmental stressors that can cause texture issues.",0.2,,1,"This stable, water-soluble form of Vitamin C is effective at brightening the skin, improving dullness, and promoting an even skin tone. It helps boost collagen production and provides antioxidant protection, making the skin appear more radiant.",1,"A stable form of Vitamin C, Magnesium Ascorbyl Phosphate helps to brighten the under-eye area by reducing pigmentation and stimulating collagen production. It addresses dark circles by improving skin tone and texture.",0.2,,0,0,0,0,0,0,0,0,0,0.2,0.2,1,0,0,0,1,0.2,0,0.2,0,1,0,0,0,0,0,0,1,0,0,1 - 5%,Moderately effective
